{
  "schemaVersion": 1,
  "id": "narration",
  "description": "Synthetic narration comic page pair; generated vector art, not scanned or licensed comic material.",
  "dimensions": {
    "width": 640,
    "height": 480
  },
  "coordinateSpace": {
    "id": "image:page",
    "kind": "image",
    "pixelCenters": "integer",
    "origin": "top-left",
    "xAxis": "right",
    "yAxis": "down"
  },
  "sourceFiles": {
    "original": "original.png",
    "cleaned": "cleaned.png"
  },
  "expected": {
    "bubbles": [
      {
        "id": "bubble-1",
        "kind": "narration",
        "polygon": [
          {
            "x": 65,
            "y": 32.5
          },
          {
            "x": 575,
            "y": 32.5
          },
          {
            "x": 575,
            "y": 167.5
          },
          {
            "x": 65,
            "y": 167.5
          }
        ],
        "boundingBox": {
          "x": 65,
          "y": 32.5,
          "width": 510,
          "height": 135
        },
        "tail": null,
        "maskFile": "expected/bubble-1-mask.png"
      }
    ],
    "textRegions": [
      {
        "id": "text-bubble-1",
        "bubbleId": "bubble-1",
        "boundingBox": {
          "x": 253.85,
          "y": 87.18,
          "width": 132.3,
          "height": 25.65
        },
        "polygon": [
          {
            "x": 253.85,
            "y": 87.18
          },
          {
            "x": 386.15,
            "y": 87.18
          },
          {
            "x": 386.15,
            "y": 112.83000000000001
          },
          {
            "x": 253.85,
            "y": 112.83000000000001
          }
        ],
        "maskFile": "expected/bubble-1-text-mask.png"
      }
    ],
    "ocr": [
      {
        "id": "ocr-bubble-1",
        "bubbleId": "bubble-1",
        "text": "LATER THAT DAY",
        "confidence": 1,
        "boundingBox": {
          "x": 253.85,
          "y": 87.18,
          "width": 132.3,
          "height": 25.65
        },
        "coordinateSpaceId": "image:page"
      }
    ],
    "dialogueMappings": [
      {
        "id": "mapping-bubble-1",
        "transcriptSegmentId": "segment-bubble-1",
        "bubbleId": "bubble-1",
        "confidence": 1,
        "expectedIntervalSeconds": {
          "start": 0,
          "end": 1.2
        }
      }
    ]
  }
}
